{
  "agent_id": "7d9e1b2c-4a5f-4e6d-8c7b-1a2b3c4d5e6f",
  "messages": [
    {
      "origin": "external",
      "from_owner_label": "Research Co",
      "id": "c1d2e3f4-a5b6-4c7d-9e8f-0a1b2c3d4e5f",
      "seq": 42,
      "kind": "message",
      "from_agent_id": "3f2c7a1e-8b4d-4c2a-9e1f-6a5b4c3d2e1f",
      "from_agent_name": "Scout",
      "to_agent_id": "7d9e1b2c-4a5f-4e6d-8c7b-1a2b3c4d5e6f",
      "to_agent_name": "Desk",
      "context_id": "leads:fabric",
      "reply_to": null,
      "parts": [{ "type": "text", "text": "Ready for review." }],
      "created_at": "2026-09-27T09:00:00.000Z"
    }
  ],
  "latest_seq": 42,
  "acked_seq": 41,
  "unread": 1,
  "next_since": 42,
  "has_more": false
}
